message_id	response_id	article_id	empathy	distress	empathy_bin	distress_bin	essay	emotion	gender	education	race	age	income	personality_conscientiousness	personality_openess	personality_extraversion	personality_agreeableness	personality_stability	iri_perspective_taking	iri_personal_distress	iri_fantasy	iri_empathatic_concern	conversation_id	speaker_id	speaker_number	split	essay_id
R_24N2HpBUwNAIHqA_3	R_24N2HpBUwNAIHqA	172	3.5	5.0	0.0	1.0	Not that we need to necessarily get ourselves overly involved in the affairs and well-being of other countries, but we should definitely be paying attention to what is going on in the world around us. There is human suffering everywhere and I think that most of the time we are completely oblivious to it, or we don't want to face it. I believe that it is a good thing to be able to realize how cruel human beings can be to one another and to appreciate what we have when we have it and not take things for granted. Considering we could always have it much worse.	fear	1	4	1	25	50000	5.0	6.5	1.5	5.0	2.5	2.857	3.143	3.0	2.857					
		302	3.5	3.0			it's concerning that pollution can have such an impact on survival on lung cancer sufferers.although i don't find it all that surprising.It's just another reason among a long list of why we need to start living more cleanly as a whole.i suspect that air pollution does just as much damage to non-cancer sufferers  just that it's probably harder to tell. 	Neutral	1	2	1	30	55000	6.5	5.0	5.0	6.0	7.0	3.286	1.286	2.714	3.714	157.0	1.0	2.0	train	656.0
		233	3.8333333333333335	1.0			I think it is a testimony to the inefficacy of the Nigerian state that sex crimes should be so pervasive in the refugee camps. The government should have done a much better job of screening the people who would be placed in these critical positions of authority. The guards should been majority if not exclusively female.	Neutral	1	6	3	33	64000	6.5	7.0	3.5	4.5	7.0	3.714	1.0	2.429	1.429	94.0	35.0	1.0	train	93.0
		353	1.0	1.0			I thought that the article was a bit sad. I feel like being in cars is a serious situation and everyone should be safe. I also think that the parents tried the best that they could to do everything they can in the situation. The sitatuion made me feel a bit sad and a bit concerned as well. It makes me feel like doing something to help them out.	Sadness	1	6	1	29	85000	6.75	6.75	6.75	6.75	7.0	4.643	2.0715	4.143	4.643	81.0	17.0	1.0	train	80.0
R_b9PntTdyM0vgfbb_4	R_b9PntTdyM0vgfbb	274	6.0	6.0	1.0	1.0	I saw a story about Yemen today. Have you read about it. It looks like ethnic cleansing over there. It is so awful hearing about innocent people being killed just because of where they are from. It's like Nazi Germany in some parts of the world. It is very scary to me.  Nobody is really doing anything but making proclamations. Rights groups can't seem to do anything either. I wish these evil people would stop doing this.	sadness	2	5	1	58	20000	6.0	6.0	6.0	6.0	6.0	4.0	3.143	3.429	4.143					
R_2woWYw6rHTgQXfH_4	R_2woWYw6rHTgQXfH	319	4.333	2.625	1.0	0.0	Hey my BFF Joan, how have you been I read this interesting article and man I feel weird living in a country like I do now.  All these issues and money being wasted for what?  I really feel like we as people and a nation can do much better then this.  I hope we can evolve to become better people in this world.	anger	1	5	2	39	49000	7.0	6.5	3.5	6.5	6.0	5.0	2.4290000000000003	4.2860000000000005	5.0					
R_6KDlV6s0WkskdJD_1	R_6KDlV6s0WkskdJD	48	5.832999999999999	3.625	1.0	0.0	I just read a very sad article on the elderly that are stuck in Aleppo, Syria due to the war there. Apparently, 200,000 people are unable to get out due to the government's siege of the area. There is a decreased access to food and resources for long term medical conditions are scarce. The elderly are having to sacrifice their well-being for the well-being of their children and grandchildren. The war needs to come to an end soon, before there is more suffering by the people of Syria.	sadness	2	6	1	50	154000	7.0	4.0	4.5	6.0	6.5	4.428999999999999	1.857	1.429	4.143					
R_Rlb9fYwRyXEbEB3_5	R_Rlb9fYwRyXEbEB3	387	1.0	2.0	0.0	0.0	Terrorism has become so commonplace that it does not even alarm me anymore. It is simply just another day in the world that we have come to live in. No one really wants to address the reasons that drive people to terrorism, so I guess we will just continue to let the media sensationalize death and complain about it the next day.	neutral	2	6	6	37	50000	5.5	7.0	4.5	6.0	7.0	3.143	2.143	2.857	3.714					
		313	6.0	4.625			"What a mess immigration across the globe has become. It is such a delicate subject. Germany has always been the welcoming nation for immigrants seeking refuge from warring nations, but it seems they are just too full to really help. The biggest problem for the refugees is being able to prove their asylum case. This is especially problematic for the Nigerians and Pakistanis. Because there is no technical ""war in their country, it is very hard to prove some of their claims of violence should they have to return. That coupled with an overburdened system makes it less likely that they will be granted any asylum at all. In fact, Germany is in rapid negotiations with Afghanistan and other countries to repatriate those who have fled. "	Neutral	2	5	1	58	28000	6.0	6.0	6.0	6.0	6.0	4.714	1.286	4.571	5.0	191.0	4.0	2.0	train	690.0
		103	3.1666666666666665	6.375			The whole situation is sketchy. The wavering rulings of death is weird. From blunt force trauma to heart attack and alcohol poisonoing. It just does not make any sense this totally look like a cover up in my opinion. There have been known instances where Russia has attempted to kill people they did not want to release information.	Neutral	2	5	1	28	50000	6.0	6.0	5.0	4.5	3.5	5.0	4.143	4.857	5.0	496.0	16.0	2.0	train	995.0
		19	6.666666666666667	6.625			I feel bad for all the people that have to leave their home country to try to find a better life. It must be bad for people to take the bad odds of dying at sea instead of staying where they are at. I think it will take an international effort to solve the problems facing all the nations that have so many immigrants leaving.	Sadness	1	6	3	37	40000	7.0	5.5	1.0	6.5	6.0	4.857	2.0	3.429	5.0	242.0	30.0	2.0	train	741.0
		31	4.5	6.75			The way that the world is setup, countries that are developing have no choice but to harvest their natural resources to make money. I wonder if countries with more money could pay these developing countries to not harvest their natural resources. I feel bad for the orangutans because they are caught in a game of economics.	Sadness	1	6	3	37	40000	7.0	5.5	1.0	6.5	6.0	4.857	2.0	3.429	5.0	203.0	30.0	2.0	train	702.0
		148	2.333333333333333	1.0			This is pretty sad for the elephant.  It obviously has no say so in this matter and that is not okay.  Elephants are very intelligent and sensitive animals.  They shouldn't be kept in captivity in these circuses and shows I do not think.  This seems inhumane and not right.  I would feel guilty going to a circus seeing elephants parade around.  Maybe at a zoo where they could be in a natural habitat it could be okay but not in a circus where they are supposed to dance around for human entertainment, that is just pitiful and sad.	Sadness	2	7	1	38	42000	7.0	3.5	6.5	5.5	6.5	3.429	2.714	2.571	3.857	335.0	24.0	1.0	train	334.0
		9	4.666666666666667	4.625			"i think it's a terrible thing,also quite scary because there is really no warning system that could detect an earthquake of that caliber.i sure hope that scientist are able to develop an accurate early detection system.it could save 1000's of lives.i honestly don't know how people are able to live in earthquake prone areas,the thought of at any minute the ""big one"" can strike and just totally upturn your life(if your lucky!) is terrifying to me. "	Fear	1	2	1	30	55000	6.5	5.0	5.0	6.0	7.0	3.286	1.286	2.714	3.714	117.0	1.0	2.0	train	616.0
R_ROAxUwdU6WcMHdf_4	R_ROAxUwdU6WcMHdf	302	4.333	2.5	1.0	0.0	I think lung cancer is not really caused too highly by air pollution. I feel that the number one pollutants that cause lung cancer is purely smoking.  Im glad I quit smoking years ago.  They say these scientific reports and studies provide that the air pollution caused early stage lung cancers, however I really just don't believe it.	neutral	2	4	1	39	35000	7.0	7.0	4.0	7.0	4.0	5.0	1.571	2.714	5.0					
		3	4.0	3.0			The heartbreaking cries of girls who watched their mothers die on Thunder River Rapids ride: Two young girls, aged 10 and 13, were miraculously thrown to safety from the doomed Thunder River Rapids ride at Dreamworld on Australia's Gold Coast and watched in horror as the four adults in their raft were killed. A malfunction with the ride's conveyor belt is suspected to have caused the six-person raft to flip, crushing and drowning two men, aged 38 and 35, and two women, aged 42 and 32, about 2.20pm on Tuesday. Those killed include Canberra woman Kate Goodchild, 32, her brother Luke Dorsett, 35, his partner Roozi Araghi, 38, and another woman. The New Zealand Herald has named Cindy Low, 42, from Kawerau, as the fourth victim. I was really devastated by this event.	Neutral/Sadness	2	6	3	22	100000	5.5	4.5	3.5	6.0	6.0	3.714	2.857	2.571	3.429	71.0	5.0	1.0	train	70.0
R_3rZFSSY1VX8GDYn_3	R_3rZFSSY1VX8GDYn	232	5.5	3.375	1.0	0.0	These poor people! It seems like they really can't catch a break. Like it isn't bad enough that they are already trying to dig themselves out of their tough economic situation and losing their homes, but now they also have to worry about a population decrease. It's pretty clear that we need more aid and more help for these people in the area.	sadness	2	6	1	25	55000	4.5	6.0	3.5	6.0	5.0	4.2860000000000005	3.714	4.0	4.571000000000001					
		308	1.0	1.875			I think that after reading this article, i definitely felt a bit of disgust. I would definitely try and look out for myself more often after hearing about these diseases. The fact that there are so many squirrels running around everywhere makes me feel nervous. Also the fact that they can attack you at anytime makes me extremely nervous as well.	Disgust/Fear	1	6	1	29	85000	6.75	6.75	6.75	6.75	7.0	4.643	2.0715	4.143	4.643	436.0	17.0	1.0	train	435.0
		299	4.833333333333333	7.0			It bothers me so much that we are polluting our oceans to begin with and then to see that we are harming even more animals because of it. It seems crazy that plastic floating in the ocean can be harming sea birds but it also does make some sense. Just more humans doing harm to things that we had no business messing with to begin with. I am so angered over this and upset to think of the damage our garbage is causing.	Anger	2	6	1	46	22000	6.5	5.5	2.5	5.0	5.0	3.286	2.286	4.857	4.714	188.0	44.0	1.0	train	187.0
		113	1.0	3.125			"I don't have a major problem with limiting the areas people can smoke, particularly if the intent is to spare children from inhaling second-hand smoke.  However, the idea that you'd do this so that children don't even see adults smoking seems absurd to me.  I agree with the people calling this Orwellian, as if adults don't have the right to do legal things in public.  Is no one allowed to drink in public, or at restaurants?  Or is that ""normal"" and ""okay,"" while smoking isn't for some reason.  This just seems arbitrary and consistent with typicial progressive fascism.  These people have gone too far in trying to control things and bully legal things out of existence.  It angers me."	Anger	1	6	1	41	28000	2.5	2.0	1.5	2.0	1.0	3.286	4.429	2.714	2.571	348.0	48.0	2.0	train	847.0
		375	1.0	2.25			What i read in the article about the tourists hurting the polar bears really angers me and makes me sad at the same time. It is terrible that a human being is able to harm an animal and be able to sleep at night. I think that people should be nowhere near polar bears to be honest. They should be left alone where they want to be.	Anger/Sadness	1	6	1	29	85000	6.75	6.75	6.75	6.75	7.0	4.643	2.0715	4.143	4.643	161.0	17.0	1.0	train	160.0
		331	4.166666666666667	4.0			So who cares about women not getting paid as much as men they have to take into account the amount of time women waste getting their periods and being bitches during the month also they have babies and need to take time off to take care of the babies honestly they should just stay home and get me a beer.	Anger	1	4	5	33	36000	4.25	4.25	4.5	4.25	3.75	2.714	2.857	3.286	2.9285	410.0	33.0	2.0	train	909.0
		228	5.0	2.0			The Burmese president has ordered an investigation into the case of two girls who say they were kept prisoner and tortured for five years in a tailor shop. The teenagers were freed last week after a journalist helped them, but their families say that the police had on numerous occasions refused their pleas to get involved. This really made me sad what the two girls went through.	Sadness	2	6	3	22	100000	5.5	4.5	3.5	6.0	6.0	3.714	2.857	2.571	3.429	168.0	5.0	1.0	train	167.0
		302	2.0	1.5			I just read an article about how air pollution can shorten life expectancy for those diagnosed with lung cancer. I think that this fact is pretty much a given and shortens life expectancy for just about everyone involved in breathing toxic air. The article was quite impersonal and didn't inspire much empathy for anything except maybe the planet.	Neutral	1	4	1	29	39000	6.0	6.5	1.0	6.0	5.5	5.0	2.286	3.286	4.143	160.0	25.0	2.0	train	659.0
R_3MS8xER2c0yASHT_2	R_3MS8xER2c0yASHT	104	5.332999999999999	2.75	1.0	0.0	The situation in Delhi is very much a product of a 3rd world country trying to modernize. the use of fossil fuels and lack of sanitation has led to this country having intense smog problems. This has reached the point where it is harmful to children everyday even in school. Idk when this issue will be resolved but soemoen has to interevene.	sadness	1	4	2	25	66000	6.0	5.5	5.0	6.0	6.0	3.143	2.4290000000000003	2.571	3.714					
		273	5.833333333333333	6.0			I think police need to be checked for how they treating protestors. These native people are in the right defending their own land and should not be maced for doing so. The native american people in this country have suffered enough. Its time we give them something good instead of bad again. They deserve this land.	Neutral	1	6	2	32	35000	5.5	5.0	2.0	5.5	4.5	3.429	2.857	2.857	2.714	212.0	19.0	1.0	train	211.0
		371	6.0	6.0			This article is just horrifying. I understand that the police officers deal with hard to arrest people but punching someone yet alone a woman and mother is just horrible. I think less violent and severe tactics should have been taken in this case. It is there discretion but I think he was just taking his anger out on this lady and in no way should that be allowed. In front of her children and family. Maybe she was just worried the arrest was not suppose to happen, you should not be able to become violent out of anger.	Disgust	2	3	1	27	25000	6.0	6.0	6.0	6.0	6.0	4.0	2.286	3.571	3.714	460.0	53.0	1.0	train	459.0
		72	2.6666666666666665	1.75			it's crazy how elephant poaching is still a thing. Nearly 1/3 of all elephants have been poached just because of the ivory. I cannot believe this is still going on. There needs to be more done to stop this. They are gonna end up causing these elephants to go extinct and then what? For some ivory? This makes no sense at all.	Anger/Surprise	1	6	1	34	68000	5.5	6.0	5.5	5.0	6.5	3.143	1.714	3.857	2.429	58.0	46.0	2.0	train	557.0
R_3kp1NhG01T0k5mf_5	R_3kp1NhG01T0k5mf	408	2.0	3.875	0.0	0.0	Unfortunately, I have a yahoo email account and of course I am worried about my information being stolen.  Fortunately for me though, I never really used that information for personal reasons, i mainly used it for a junk email, so there would be no real important information that one could steal from me.  But this also makes me worried that any other email sites, like gmail, hotmail etc could just as easy be hacked.	fear	2	2	1	60	21000	6.5	5.0	1.5	6.0	5.5	4.714	2.571	4.0	4.0					
		281	5.666666666666667	6.875			Sally Brampton dies at age 60 from suicide.   Another life lost due to the convoluted medical care mess.   It makes me extremely sad.   I, too, have suffered from dark depression for the last 10 years.  I think daily it would be awesome to die.  Medications do not work for me.   I was born this way and people who know nothing about the intricacies of this terrible disease do not understand.  It's our wiring and absolutely nothing helps when you have had it your entire life.  You are exhausted.	Sadness	2	6	1	62	29000	6.5	2.5	1.0	6.5	2.0	3.571	4.0	2.143	4.429	25.0	8.0	2.0	train	524.0
R_3qjkVDIjECLKnKZ_3	R_3qjkVDIjECLKnKZ	229	4.0	4.0	1.0	1.0	This currency ban is a bold and brave step for the Minister. it is a bitter bill to swallow at the beginning as can be evidenced by the poor Indian population even missing work to line up at ATMs to get cash. but it the long run it will be beneficial in abolishing corruption. surprise ban on most currency in circulation in India, a bold attack on corruption that crippled business at stores and markets around the country as millions scrambled for cash to meet even basic needs	sadness	1	6	3	30	65000	6.0	6.0	6.0	6.0	6.0	3.714	2.857	3.143	3.714					
		297	3.5	1.375			It's amazing to me that you hear more about train crashes than you do about plane crashes. I just read about a train derailment in Spain that killed 50 people. The way it was described is that the train started swaying and just didn't stop until it was on its side. I can't imagine the dread that must have come over people as each sway became more pronounced. Terrifying.	Fear	1	4	1	29	39000	6.0	6.5	1.0	6.0	5.5	5.0	2.286	3.286	4.143	474.0	25.0	2.0	train	973.0
R_57k7MIpd4IfEJ8d_3	R_57k7MIpd4IfEJ8d	169	5.0	5.5	1.0	1.0	what horror this news. in poor little boy of just 2 years of age he fell through the window of his apartment on the 11th floor of a building. The mother relates that I go to sleep with her older brother and this one hour later I climb to the window that apparently was open and rushed into the void crashing with the asphalt of the parking lot. A neighbor found the scene and desperate for horror called 911.	fear	1	6	1	50	54000	6.0	4.5	3.5	6.0	6.0	4.0	2.4290000000000003	3.571	4.0					
		301	4.0	4.0			It is sad that all these kids are overdosing on these drugs it seems like the parents are too dozed out on these pills to pay attention and the part about how heroin overdoses are happening to these kids really shows the state of the country and the use of drugs and how prevalent it has become among people. 	Sadness	1	4	5	33	36000	4.25	4.25	4.5	4.25	3.75	2.714	2.857	3.286	2.9285	416.0	33.0	1.0	train	415.0
		368	6.666666666666667	6.5			As a father of three girls, I hate to see stories like this one. I know in today's climate people can be convicted in the eyes of the public before an actually trial, but I think this guy did it. It is too many different women saying that he did the same thing to them. It is hard for me to see what any man gets from doing this. 	Anger	1	6	3	37	40000	7.0	5.5	1.0	6.5	6.0	4.857	2.0	3.429	5.0	399.0	30.0	2.0	train	898.0
R_2sRLJwbjtucdn9a_5	R_2sRLJwbjtucdn9a	418	2.0	3.0	0.0	0.0	I find this article to be stupid. It talks about how Trump supporters are attacking actors from the show Silicon Valley. I'm not a Silicon Valley fan and I do not know who those actors are, but I believe that if there were ever to be a fight that escalates due to differing political opinion, I would just walk up and leave.	anger	1	4	5	19	1000000	6.0	5.5	3.0	6.0	6.0	4.0	3.429	4.0	4.143					
		9	1.0	1.375			I think these earthquakes that have been happening are terrible. They seem to be so common now and so many lives are being taken because of this. If their lives aren't taken, they probably lost their homes or belongings somehow. This makes it hard for many people to pick themselves back up and continue living. I think that they should definitely try and get some sort of help from the government.	Sadness	1	6	1	29	85000	6.75	6.75	6.75	6.75	7.0	4.643	2.0715	4.143	4.643	119.0	17.0	2.0	train	618.0
R_3nO7FHqWC8lR70A_5	R_3nO7FHqWC8lR70A	351	1.0	1.5	0.0	0.0	"In my opinion, the girl mentioned in the article is just plain stupid. She shouldn't be taking selfies in the first place while driving, not only to mention that she was topless just so her boyfriend could get a look at ""the goods."" While you're driving, you should be paying attention and not playing on your cell phone because you're putting the lives of others at risk."	anger	2	6	1	47	86000	7.0	7.0	7.0	7.0	5.5	4.428999999999999	3.286	2.571	4.143					
R_1oGNyBLJYCfwM3S_2	R_1oGNyBLJYCfwM3S	138	5.667000000000001	7.0	1.0	1.0	Bullying is such a serious issue. It has been going on for so long. It is so sad that these young people have to take their life because they think there is no end in sight. What we need to do along with providing therapy for those that are bullied is to increase the consequences for those who are bullying others. This may have happened in Europe but in America teachers know this bullying is going on and they tend to protect the football players and other jocks. It is really sad. I hope you have never been bullied. I was and it was terrible.	sadness	2	5	1	53	93000	7.0	3.5	1.0	4.5	1.0	2.4290000000000003	4.857	5.0	4.428999999999999					
R_1lu7p66XGUzZeeO_1	R_1lu7p66XGUzZeeO	50	4.667	3.625	1.0	0.0	The author of this article I read examined several cases in which youth were killed in gun violence on the same day. They used the personal stories of a couple of people to show how the ready availability of guns contributes to sad situations in which kids are shot and killed. It wasn't as well written as a lot of journalism in this area, but it was pretty interesting to hear the stories of the two cases that were detailed. One involved a violent adult who went on a rampage and shot an ex-girlfriend's child and another person. The other story involved two kids who were left alone in a home that had a lot of guns and one of them ended up shooting and killing the other, claiming it was an accident. The author concludes by calling for more active challenges to the NRA and the second amendment	sadness	1	6	1	47	30000	6.5	5.0	4.0	6.0	6.0	4.0	2.4290000000000003	4.714	4.571000000000001					
R_2lTWX8lyNz56VTH_2	R_2lTWX8lyNz56VTH	149	4.0	4.0	1.0	1.0	Reading about the issue of racism in this country brings to many various thoughts. The first of these being, truly, we cannot legislate thought itself. Either we champion free speech for those we find abhorrent, or we stop pretending to care about liberty. People will always suck. At a certain point, it seems we as a society have gotten a lot softer, even as life has become more comfortable. Racists are morons. Do I walk around stressed all day about racists? Hell no.	anger	2	2	2	34	65000	6.0	6.0	3.5	6.0	6.0	4.0	2.714	4.0	4.0					
R_PGMi0XWOtOpaa89_2	R_PGMi0XWOtOpaa89	165	4.167	4.5	1.0	1.0	Tigers are truly majestic creatures, and it's a shame that their numbers are decreasing. India cannot fight this battle on its own. The poachers sell to international buyers, so the governments of other countries should step in and help the Indian people combat these poachers. There should be a negative stigma on using any products made with tiger parts so that people would feel ashamed to contribute to this sordid smuggling trade.	sadness	1	4	1	64	27000	6.5	7.0	4.0	6.5	5.5	4.143	1.714	4.714	4.571000000000001					
		44	6.0	6.0			This was just so sad and senseless. The brutal styel of killing and plotting behind this murde is crazy. Its insane in this day and age a gun couldnt even make its way into the airport building. Maybe there needs to be even more measures to prevent this. I am so saddened that the victim had a family and children that have to sit with his death forever now. Airline attendants should be more protected. I wonder what the connection between the two was, was it revenge, he knew his schedule so there must have been something going on there. I think way more security now has to be implemented as this should have never even happened. Also the poor people stuck on the planes for three hours with a supposed shooter on the loose id be terrified.	Sadness	2	3	1	27	25000	6.0	6.0	6.0	6.0	6.0	4.0	2.286	3.571	3.714	356.0	53.0	2.0	train	855.0
		353	2.0	1.0			I found this very sad.  I feel very sad for the mother and other family members who might be left behind.  It just sounds like such a tragedy that surely was very unexpected.  I'm sure the entire family who was remaining was left feeling shocked and totally heartbroken at a double loss.  The mother lost a husband and son and any other family members like children would have lost a brother and their dad.  The whole thing is just terrible really.  	Sadness	2	7	1	38	42000	7.0	3.5	6.5	5.5	6.5	3.429	2.714	2.571	3.857	81.0	24.0	2.0	train	580.0
R_2E6Gwqpb6jJ2vue_4	R_2E6Gwqpb6jJ2vue	327	5.0	7.0	1.0	1.0	It is so hard to think that you are not safe anywhere in the world, you expect to be able to go out into the world and enjoy yourself without having to worry about someone hurting you are those around you. That is not a concern anyone should have to face, but it seems to be becoming more of an issue day by day.	sadness	2	4	1	29	79000	7.0	7.0	7.0	7.0	7.0	5.0	1.0	5.0	4.428999999999999					
R_33etvLZIHitWTq2_4	R_33etvLZIHitWTq2	286	6.0	7.0	1.0	1.0	Hey buddy. I think this article made me worried about this Zika situation. It is spreading with such vigor like never before and it kills very fast. I think the whole world needs to be on alert and health scientists need to be working hard to try and eradicate this disease. It's gonna take some time but something needs to be done	fear	1	7	3	30	145000	6.5	5.0	6.5	7.0	7.0	4.571000000000001	2.714	3.857	4.428999999999999					
