message_id	response_id	article_id	empathy	distress	empathy_bin	distress_bin	essay	emotion	gender	education	race	age	income	personality_conscientiousness	personality_openess	personality_extraversion	personality_agreeableness	personality_stability	iri_perspective_taking	iri_personal_distress	iri_fantasy	iri_empathatic_concern	conversation_id	speaker_id	speaker_number	split	essay_id
		128	1.0	1.125			Ehh I never really know what to think about claims like this.  On the one hand, her roommates claim that they remember hearing her talk about it at the time.  On the other hand, why wait twenty years to bring up an incident that happened that was that disturbing?  I think some women are making allegations and accusations just to get attention or for political motivations.  Who knows why.  People do crazy things for crazy reasons.  I'm just really skeptical of a lot of these things I hear and I think the #metoo movement has gotten way out of hand.  Sorry, just my two cents.  	Anger	2	7	1	38	42000	7.0	3.5	6.5	5.5	6.5	3.429	2.714	2.571	3.857	232.0	24.0	1.0	train	231.0
		397	4.0	4.125			It is terrible what is happening to the rivers and the animals I think global warming could be playing a role in the matter the animals are being effected and soon humans will feel the effects of global warming hopefully they get some rain soon and they can save these poor animals facing all this hardships	Sadness	1	4	5	33	36000	4.25	4.25	4.5	4.25	3.75	2.714	2.857	3.286	2.9285	426.0	33.0	1.0	train	425.0
R_11d2f4aGBETtClb_4	R_11d2f4aGBETtClb	254	1.0	4.5	0.0	1.0	This is just part of the troubling times we live in.  There is a monster in the white House that a majority of the people did not elect and the Russian government had a hand in coming to power.  He is breaking laws everyday and has the most corrupt cabinet in my lifetime.  His agenda is simply to cause chaos and to profit off this as much as possible.  The sooner this failed experiment is over the better of the nation will be.  The only hope is that he doesnt start a nuclear war and that he will eventually be tried and brought to justice for his numerous crimes.	anger	1	6	1	48	50000	7.0	7.0	7.0	4.0	7.0	3.857	1.0	4.857	4.143					
R_2lTWX8lyNz56VTH_3	R_2lTWX8lyNz56VTH	241	4.0	4.0	1.0	1.0	This article I just read is incredibly intellectually dishonest. The notion that women were somehow exiled from talking points and inclusion in the Trump campaign is actually nauseating. This kind of narrative is truly what the modern liberal exists upon. It's disgusting. I'm not a Trump fan, but mark my words, this kind of crap will be the reason why he wins in 2020.	disgust	2	2	2	34	65000	6.0	6.0	3.5	6.0	6.0	4.0	2.714	4.0	4.0					
R_ddqYcWLm4IGB1yF_3	R_ddqYcWLm4IGB1yF	230	5.332999999999999	7.0	1.0	1.0	How I wish some leaders were like Barrack Obama because some do not believe that global warming is happening.He has encouraged people to start protecting the environment to avoid global warming from harming us.Some countries have already signed up agreements that will help them like the paris agreement.	joy	1	6	3	32	60000	6.5	5.5	6.0	6.0	5.0	4.571000000000001	2.857	3.857	4.571000000000001					
R_3IcLlPaNnV7X4qq_5	R_3IcLlPaNnV7X4qq	359	1.0	1.625	0.0	0.0	Is it too much to ask for a judge that follows the Constitution? Check this article out and see if you agree. Focusing on fringe issues is not going to unite us. I wish we could move past this and leave people's personal beliefs out of it and focus only on the law. that would be nice for a change, woudln't it?	anger	1	4	1	42	105000	6.0	5.0	1.0	5.0	4.5	3.571	1.571	4.143	3.714					
R_3esJBiP6MpPHx3n_2	R_3esJBiP6MpPHx3n	135	3.5	1.875	0.0	0.0	Hey, aren't you from the south? Have you had any issues with wildfires in your area? There's all this talk about forest fires and droughts in California, but this is the first time I've heard about stuff going down in your area. Everything okay down there? Make sure you stay safe! I know you don't go out much, but it doesn't take much to have a disaster to fall on your doorstep.	surprise	2	7	1	29	48000	6.0	4.5	2.5	4.5	3.5	4.143	3.714	4.857	4.857					
R_Dwv0KHEDJhBKMO5_4	R_Dwv0KHEDJhBKMO5	280	4.167	3.375	1.0	0.0	I can't even imagine what it would be like to be minding our own business in a club and then having someone come in and shoot you. This must have been terrifying for this person. I certainly hope they did not lose their life and I also hope this is not an incident that leads to further problems in the future.	fear	2	6	3	36	30000	7.0	6.5	5.5	7.0	7.0	4.2860000000000005	1.571	4.2860000000000005	4.857					
		66	1.0	1.75			After reading the article, you can't help but feel sorry for the people that were affected by the fire. It's a good thing that most only had minor injuries and there weren't any deaths though. I think that something like this is terrible because it is an accident of one person that can really hurt others as well. Hopefully people are more careful in the future.	Sadness	1	6	1	29	85000	6.75	6.75	6.75	6.75	7.0	4.643	2.0715	4.143	4.643	390.0	17.0	1.0	train	389.0
R_sXd7G0qsBBO5rup_5	R_sXd7G0qsBBO5rup	392	4.167	6.5	1.0	1.0	Well, this is frustrating. Not only will the new law not really help, but it doesn't sound like anything will help. It's a good point, about having to get the fishers on board with saving the paquita, but I don't know how to convince them. If it came down to feeding my family or saving a handful of dolphins that are probably going to die out anyway, there's a good chance I'd pick my family.  The story's a year or two old -- so once I've finished doing what I'm doing, I'm going to look up the paquita and see what's happened since then.	sadness	2	6	1	59	25500	4.0	6.0	2.5	5.0	4.5	3.571	2.714	4.714	4.143					
		417	1.0	1.125			In this case I totally support the actions of the man who shot the dog.  He was totally within his rights and it was highly inappropriate and inconsiderate of that woman to have an unleashed dog running int he park.  The man asked her to restrain her dog when it attacked her and she failed to do that several times so she had fair warning.  I'm sick of dogs running wild and attacking innocent bystanders, often resulting in grave bodily injury or death.  Somebody needs to do something to stop this problem.	Anger	2	7	1	38	42000	7.0	3.5	6.5	5.5	6.5	3.429	2.714	2.571	3.857	222.0	24.0	1.0	train	221.0
R_2QheVsRf9k1s9xo_1	R_2QheVsRf9k1s9xo	77	1.0	6.25	0.0	1.0	I just learned about the British banker who killed the two Indonesian women in Hong Kong. How horrifying that we have people like this in the world. They seem like your everyday ordinary person, but it shows you just never know. You always have to stay safe, not take chances and don't trust appearances.	fear	2	4	5	36	20000	2.0	2.0	2.0	2.0	2.0	3.429	4.0	2.286	3.714					
R_2V1EtzSABylaDxN_3	R_2V1EtzSABylaDxN	189	1.167	1.125	0.0	0.0	This is a big price for reality shows featuring filthy rich people who care more about being seen than being safe. I'm sorry, I can't feel too bad for Kardashian West for being robbed, with so much tempting loot around. It must have been frightening for her to be tied up, but if I were that rich, I certainly would not flaunt it.	sadness	2	6	1	58	35000	6.0	6.0	2.0	6.5	4.0	3.571	2.0	3.571	3.0					
		326	5.666666666666667	5.75			I can relate to the Jewish in the sense that I too struggle to realize and accept the fact that Trump got elected. I think the realization that he got elected is one that I tend to think  made me realize the USA was not the country I thought it was. At the end of the day its good that it happened because we realized that we are not perfect as a country.	Neutral	1	6	2	32	35000	5.5	5.0	2.0	5.5	4.5	3.429	2.857	2.857	2.714	468.0	19.0	1.0	train	467.0
		347	4.333333333333333	3.625			It is terrible that these kids have to starve but it was kind of funny that they were boiling grass I mean think about these africans they always have some sort of crisis even when they are rich in oil they still manage to ruin everything they are like monkeys they resemble apes they behave like animals	Disgust	1	4	5	33	36000	4.25	4.25	4.5	4.25	3.75	2.714	2.857	3.286	2.9285	304.0	33.0	1.0	train	303.0
R_1Ed2vTIhJK2Lz4I_2	R_1Ed2vTIhJK2Lz4I	100	4.0	4.625	1.0	1.0	I canot believe that there are citizens in this county, particularly in Minnesota, who are vulnerable enough to be manipulated by ISIS to kill individuals in their country.  The Somali group in Minnesota has a history (several known cases) of people attempting to commit murder for the terrorist group.  Tragically, an Somali man has just gone on a murder spree.  He has not been linked to ISIS and his motivations are unclear, but I am disturbed.	fear	5	7	3	34	100000	5.5	4.0	6.0	5.5	5.5	4.0	1.857	2.857	4.143					
		245	2.333333333333333	1.0			This is sad for the woman and the family!  It sounds like she had some sort of dementia and alzheimers which is really scary.  Hopefully she is okay and will be able to be reunited with her family.  It is sad when people get so old that they are deteriorating so much.  I hope my parents don't decline that much as they age but they possibly will.  My grandparents definitely.  anyway, hopefully, they can get better services to help people like this and avoid situations like the one in the article.  	Sadness	2	7	1	38	42000	7.0	3.5	6.5	5.5	6.5	3.429	2.714	2.571	3.857	240.0	24.0	1.0	train	239.0
		91	3.6666666666666665	4.125			This is pretty sick I can not believe that parents could be that sick but it must be white people they like to do sick perverted stuff like this they are the ones that ruin everything we need to really look at society and see how we need to improve the way that things are going into the world it is crazy	Disgust	1	4	5	33	36000	4.25	4.25	4.5	4.25	3.75	2.714	2.857	3.286	2.9285	380.0	33.0	2.0	train	879.0
R_03ql4LGD9I0cM7f_4	R_03ql4LGD9I0cM7f	290	4.667	4.75	1.0	1.0	The shark attack described was distressing.  I'm glad to know that the victim is okay.  There is something about shark attacks that seems so unexpected and primal...really frightening.  At the same time I can appreciate how people want to protect the natural wildlife in the area.  Its a tough call.  I know the measures they take will never be perfect.  I guess I'm on the fence about what they're doing to protect the sharks.	fear	2	6	1	56	119000	6.0	5.5	5.0	6.0	6.0	3.857	2.143	3.714	3.571					
R_1HoxPF6qzy4BIwm_4	R_1HoxPF6qzy4BIwm	313	7.0	6.5	1.0	1.0	Thinking about the refugee situation around the globe is so disheartening. There are so many people who are only trying to survive who cannot find support anywhere. Those of us in countries with resources really need to start pushing out legislators to accept and support these people, especially when their situations are the result of our own policies. Humans need to look out for each other far more--we should value every life the same, no matter the country of its origin.	sadness	2	6	3	32	85000	5.0	7.0	6.5	6.5	3.0	4.143	3.0	4.857	4.714					
		242	7.0	5.5			This article is about a mission where American military were helping to train Afghan military targeting Taliban leaders. In the attack that was instructed by the American troops, Afghan civilians were killed. It was obviously not something that anyone wanted to happen, but when fighting erupted, innocent people were killed.	Neutral	2	6	1	47	110000	7.0	6.5	4.5	5.5	7.0	5.0	2.143	3.571	5.0	293.0	57.0	2.0	train	792.0
		138	6.166666666666667	6.25			Bullying isn't a new thing and it is something that must be dealt with swiftly. We must find a way to fix this stuff because it is not new and keeps happening around us. Not only in France but all around the world kids suffer from this and it leads to many suicides. The pressure from other kids is huge.	Neutral	1	6	2	32	35000	5.5	5.0	2.0	5.5	4.5	3.429	2.857	2.857	2.714	70.0	19.0	1.0	train	69.0
R_2D1CnjTj1WSuPQk_1	R_2D1CnjTj1WSuPQk	32	4.5	1.0	1.0	0.0	There are a lot of things in this article that I don't agree with. I don't think that being gay is a mental problem, but I do believe that it is a sin. The only way for people to stop committing this sin is for God to work in their lives. I don't know a lot about conversion therapy, but i'm not so sure that this is the way to go. I also don't believe that trump is anti gay. He hasn't done anything that would make him anti gay.	anger	2	5	1	37	60000	4.0	2.5	1.5	4.0	4.0	2.286	3.429	3.0	3.143					
		326	1.0	2.5			Another article about politics slamming one side or the other.   The article refers to America has to heal.   The only way it can heal is people have to quit thinking about me, me, me, and look out for the nation and others.   It seems it just comes down to what vitriol will be posted to some social media site.  People are numb to all of it yet all the national media continues to support one side or the other and not see it as what it is.  	Neutral	2	6	1	62	29000	6.5	2.5	1.0	6.5	2.0	3.571	4.0	2.143	4.429	470.0	8.0	2.0	train	969.0
R_sXd7G0qsBBO5rup_1	R_sXd7G0qsBBO5rup	34	6.167000000000001	6.5	1.0	1.0	This breaks my heart. I mean, I know there's trouble everywhere, but these people have absolutely no hope, and the United States caused this, so we share responsibility. I'm going to look around and see which refugee organizations are trying to help, and gather donation information. Are you in? I'll see if Alan wants to bring this up at church, too.	sadness	2	6	1	59	25500	4.0	6.0	2.5	5.0	4.5	3.571	2.714	4.714	4.143					
		210	6.666666666666667	1.25			That is so sad what happened to the people at the concert. I can't imagine why someone would want to do something like that. What would they get from it? I feel so badly for the families involved. It was over 100 people. It is just so sad. It's nice what they are doing with the concerts now, but nothing will bring those people's family members back.	Sadness	2	6	1	47	110000	7.0	6.5	4.5	5.5	7.0	5.0	2.143	3.571	5.0	47.0	57.0	1.0	train	46.0
		223	6.5	2.875			I feel bad for the mother and her two daughters that died in the accident. I'm a person that worries and being in a trailer would have me worrying. It is very sad that their life were cut short because they wanted to enjoy sometime together and go for a ride on Halloween.  I hope that the other people involved in the crash find peace.	Hope/Sadness	1	6	3	37	40000	7.0	5.5	1.0	6.5	6.0	4.857	2.0	3.429	5.0	340.0	30.0	2.0	train	839.0
		182	5.833333333333333	5.875			How someone can have the cold heart to strangle a living thing let alone a baby kitten to death is beyond me.  Imagine the pain the poor thing felt? How can we let people that do these things continue to live amongst us. Surely there must be some justice for this? What a disturbing case if I've ever seen one.	Anger/Sadness	1	6	2	32	35000	5.5	5.0	2.0	5.5	4.5	3.429	2.857	2.857	2.714	454.0	19.0	1.0	train	453.0
R_1DDb7pcl8PkL7Rz_5	R_1DDb7pcl8PkL7Rz	418	3.833	4.875	0.0	1.0	our president party people are making something stupid on some occasions, you see ‘Silicon Valley’ stars recount being harassed by Donald Trump supporters. some one insulting Trump and making fight with them, its not necessary. unwanted fights and unwanted speech should be avoided. because all are having responsible position and work to do, At bar doing nasty things no good using some people name	anger	1	7	1	32	70000	1.5	6.5	4.5	1.5	6.5	3.714	2.143	2.4290000000000003	3.429					
		67	5.833333333333333	5.0			Just got finished reading an article about the number of refugees who are perishing while trying to traverse the Mediterranean sea on their way from war torn countries. Apparently, the E.U. is still more focused on preventing these people from reaching their shores than they are trying to protect them. Personally, I think that the U.S. and Russia should be taking more than their fair share of these displaced people.	Disgust	1	4	1	29	39000	6.0	6.5	1.0	6.0	5.5	5.0	2.286	3.286	4.143	105.0	25.0	1.0	train	104.0
		150	4.833333333333333	5.75			Its quite sad when crashes like these happen and when they do happen I can't help but feel like something could have been done to prevent it. I feel like as humans we do not do enough to try and prevent all of these crashes. The fact that it was a routine training flight with the aerobatics team makes it worse. IT was also the first woman to fly a China j_10 fighter.	Sadness	1	6	2	32	35000	5.5	5.0	2.0	5.5	4.5	3.429	2.857	2.857	2.714	63.0	19.0	2.0	train	562.0
		35	5.833333333333333	6.0			I wonder why there aren't more people trying to help these people. I understand Haiti is not the richest nor less corrupt country but surely there must be a way to help. Supplies being looted by crowds is understandable because they are hungry and people need food and water to survive. We must think of other ways to distribute the food and water.	Anger	1	6	2	32	35000	5.5	5.0	2.0	5.5	4.5	3.429	2.857	2.857	2.714	3.0	19.0	1.0	train	2.0
		11	2.0	1.0			This is clearly sad because of the innocent people involved.  IT is always a tragedy when innocent civilians are caught up in the violence and politics of a government in trouble.  This seems like the situation here, and the people are the ones who are paying the price.  It is unfortunate these groups can't see the harm they are doing and just cease all violent activities.  When are people going to learn?  	Sadness	2	7	1	38	42000	7.0	3.5	6.5	5.5	6.5	3.429	2.714	2.571	3.857	447.0	24.0	1.0	train	446.0
		281	6.333333333333333	6.25			We always think the moment someone is rich and have enough money to throw around, they are void of worries and life problem. I mean here is someone who was bold enough to ask for help yet no one reached out to help. I feel so bad knowing this. Depression is real and hit even the most unsuspecting people. It is so bad that she died without anyone showing her true love.	Neutral	1	7	1	28	165000	6.25	5.75	3.25	6.75	6.0	3.357	2.429	3.2145	3.4285	24.0	40.0	2.0	train	523.0
		308	2.1666666666666665	1.75			I just read an article about instances of red squirrels in the U.K. contracting leprosy. Apparently. there are only three species of mammal on the planet that can actively carry and suffer from the disease, which include: humans, banded armadillos and now red squirrels. I also wasn't aware that it kills nerves throughout your body so that infections can go unnoticed, resulting in amputations of limbs.	Neutral	1	4	1	29	39000	6.0	6.5	1.0	6.0	5.5	5.0	2.286	3.286	4.143	438.0	25.0	1.0	train	437.0
		163	5.833333333333333	6.0			The fact that it wasn't criminals that did this to the poor girl but security personnel speaks volumes on the world as a society. Pellets are seen as not harmful but the reality is they c an even cause blindness. We must do what is right and correct the wrongs in society by educating people on the harms that they cause.	Neutral	1	6	2	32	35000	5.5	5.0	2.0	5.5	4.5	3.429	2.857	2.857	2.714	362.0	19.0	1.0	train	361.0
R_3CJWhgP9ecOVgZL_3	R_3CJWhgP9ecOVgZL	180	1.0	1.0	0.0	0.0	Well, I dont really feel much about this either way. I feel badly for the family of the victim, I'm sure they are devastated, but it's not surprising something like this would happen, given the type of things he wrote, and the climate in the country in which they lived. My thoughts of out to the family.	sadness	2	2	1	41	69000	7.0	1.5	2.0	7.0	6.5	3.429	2.4290000000000003	1.0	4.571000000000001					
		413	5.5	1.0			This is an incredibly sad story!  All these people out trying to have fun and then they lost their lives.  I imagine the fear when they were hiding, it must have been so terrible.  And the families are just as much victims as the people who lost their lives.  The whole thing is terrible, and all of this for nothing.  Terrorist attacks are the most senseless killing and loss of life.  It is really tragic to me, and these people seem to have no regard for human life or suffering.  IT's not even human.	Sadness	2	7	1	38	42000	7.0	3.5	6.5	5.5	6.5	3.429	2.714	2.571	3.857	255.0	24.0	2.0	train	754.0
		57	5.333333333333333	4.375			"I just read an article about a rescue of zoo animals from the alleged ""Worst Zoo on the Planet."" I wish it wasn't so easy for me to believe that the proprietors of the zoo blamed the deaths of animals and horrible conditions on armed conflict that their country primarily instigated. The zoo wasn't even targeted in attacks on the area. I'm not a big fan of zoos in the first place, but it is nice to know that there are groups out there to look out for the best interest of these poor animals."	Neutral	1	4	1	29	39000	6.0	6.5	1.0	6.0	5.5	5.0	2.286	3.286	4.143	99.0	25.0	1.0	train	98.0
R_3qDqiG7g35x0oqN_3	R_3qDqiG7g35x0oqN	207	3.833	3.875	0.0	0.0	What I learned is that one of the things I learned was Allah is with the patient people, that only Allah can protect a person, that Allah Is the best protector, Good and bad come from him alone, that we should depend on him for everything, that he will reward the believers who are suffering for having patience because Allah I always with the good people, I believe justice will be served on judgement day.	neutral	2	6	1	28	56000	3.0	3.5	5.0	3.5	4.5	3.286	2.286	3.429	3.286					
		347	5.833333333333333	6.125			Anything fellow human beings are struggling with hunger we as humans must find a way to be able t o  help them out. I feel like if we are starving we would want as Americans someone to step in and help us. It is the right and the only way to do things to be honest. I feel like Nigeria is too corrupt to help itself at this point.	Neutral	1	6	2	32	35000	5.5	5.0	2.0	5.5	4.5	3.429	2.857	2.857	2.714	305.0	19.0	2.0	train	804.0
		308	1.1666666666666667	1.5			I guess i hope those red squireels are going to be ok.  to be honest, i don't reallllyyy care thaaaat much, but I don't want to see them go.  I like keeping as many species of animals around as possible for our future generations to be in awe of.  It's unfortunate that humans keep fucking it up for native species.	Anger/Neutral	1	5	1	31	82000	3.5	2.5	2.0	4.5	5.0	3.571	2.286	1.857	2.0	439.0	49.0	2.0	train	938.0
R_2c5UkddgXqWcNqs_1	R_2c5UkddgXqWcNqs	26	1.6669999999999998	4.5	0.0	1.0	Hello friend, have you read this article? I think you should, it's quite interesting if I do say so myself. It is about a Representative named Darrell Issa, he is a Republican and has a Southern California seat. How great would it be, to see this massively bad man lose? Hopefully, Issa may well quote Mercutio on November 8th: “...ask for me to-morrow and you shall find me a grave man.”	disgust	2	5	1	24	35000	2.0	4.0	2.0	5.0	6.0	3.571	2.857	3.714	3.286					
R_PBbNxpYdnlgFsU9_5	R_PBbNxpYdnlgFsU9	368	5.5	5.625	1.0	1.0	"sexual assault is the major problem in the country there were many cases first , second and third degree reported.the recent story of the UW-Madison student who was charged in alleged attacks on 5 women —sexual assault against a University of Wisconsin student led to multiple charges based on claims from five women. combined with the viral nature of social media, has resulted in modern-day character assassination that is very real and very wrong."" How to help survivors of sexual assault might be spread over the media or the other sort"	anger	2	7	5	44	30000	4.0	4.5	4.0	7.0	4.0	4.0	3.714	3.286	3.714					
		242	4.166666666666667	5.125			I hate hearing about American troop deaths.  I feel sad for the Captain and First Sergeant who died.  Those are experienced and high-ranking people.  I don't feel as sympathetic for the civilians who died.  I believe strongly that if you're going to fight a war, you fight it hard and collateral damage is expected.  We won WWII by leveling Germany and nuking Japan.  You can't try to isolate the bad guys and kill only them.  It doesn't work that way.  Killing civilians may seem harsh but it ends wars.  When you just try to fight the insurgents or guerillas, wars don't get won.  They just keep going.  And that doesn't accomplish anything but more death.	Anger/Sadness	1	6	1	41	28000	2.5	2.0	1.5	2.0	1.0	3.286	4.429	2.714	2.571	291.0	48.0	2.0	train	790.0
R_2YArZsw1g1y22lR_1	R_2YArZsw1g1y22lR	66	4.333	5.0	1.0	1.0	I just read a horrible article online about 10 people getting hurt after a huge fire started in an apartment complex in Arizona. That is so horrible I really feel bad for them. The say that eight of the people had minor injuries so that is good that it was only minor. Unfortunately one person had to be taken to the hospital but they are in stable condition so that is good news. Apparently two people outside of the apartment were also hurt by the fire some how. I think they were able to get the fire under control pretty easily though cause it only lasted around 10 minutes. They had to have the gas company come and shut off the gas and apparently they are investigating what could have caused the fire in the first place. That reminds me of the fire that happened at my neighbors house.	sadness	1	6	1	28	100000	3.0	3.0	2.0	4.5	4.5	2.714	4.0	3.143	1.857					
		397	1.0	1.75			After reading the article, my heart just breaks for all the wildlife that was affected. I believe it is mostly human fault that this is happening in the first place. The animals as well as wildlife needs to affected because of the bad decisions we make. It is terrible and i feel like it's time for humans to make a change to really help other living things.	Sadness	1	6	1	29	85000	6.75	6.75	6.75	6.75	7.0	4.643	2.0715	4.143	4.643	426.0	17.0	2.0	train	925.0
R_2c5UkddgXqWcNqs_5	R_2c5UkddgXqWcNqs	380	4.0	5.0	1.0	1.0	I feel really bad for the woman, Janis Barinsky, this article is writing about. Nobody should have to go through such torture and borderline abuse at their workplace to endure this type of behavior and thoughts. For a company to treat their employees this way and to push them to the verge of suicide is just out right awful.	sadness	2	5	1	24	35000	2.0	4.0	2.0	5.0	6.0	3.571	2.857	3.714	3.286					
