message_id	response_id	article_id	empathy	distress	empathy_bin	distress_bin	essay	emotion	gender	education	race	age	income	personality_conscientiousness	personality_openess	personality_extraversion	personality_agreeableness	personality_stability	iri_perspective_taking	iri_personal_distress	iri_fantasy	iri_empathatic_concern	conversation_id	speaker_id	speaker_number	split	essay_id
		375	3.1666666666666665	1.0			It is difficult to convey my thoughts and feelings regarding the article as it was not very detailed. It is alarming that polar bears are facing threats to their habitats. I think conservation efforts as a whole should be increased worldwide. Human beings are causing irreparable harm to the ecosystems of this planet and it has to stop. 	Neutral	1	6	3	33	64000	6.5	7.0	3.5	4.5	7.0	3.714	1.0	2.429	1.429	163.0	35.0	2.0	train	662.0
		3	2.5	3.25			Hello friend. It's with a heavy heart that I'm typing this. The story of what happened to those people is really pathetic and saddening. I feel really terrible about the event. Accidents of such nature are highly predictable and can be easily avoided but because of negligence and greed, operators won't properly maintain their machines. It's just sad	Sadness	unknown	unknown	unknown	unknown	unknown	unknown	unknown	unknown	unknown	unknown	unknown	unknown	unknown	unknown	74.0	31.0	1.0	train	73.0
R_2qxSe9C1FHoZe8D_4	R_2qxSe9C1FHoZe8D	335	2.333	1.0	0.0	0.0	Apparently the giant albatross is being destroyed by giant mice that have overrun one of their main breeding islands. I don't exactly understand how, but the parents haven't learned that the mice are a threat and just sit there and watch them eat the babies. Seeing as how they are meat eaters you'd think the mice would provide an easy snack.	surprise	2	6	1	34	39000	6.5	6.0	7.0	6.5	7.0	4.0	3.286	4.2860000000000005	4.857					
		48	6.0	5.0			This article was just heartbreaking. I just pictured my father working his whole life for us just for a warm and horrible people to come in and tear it down. It is pure hell for everyone living in this war torn area I cant imagine. No older people who worked there life so there familys can be better should be worried about war and losing the family. The doctors have even fled as there is no resources to help people anymore. Only once dialysis center left which will probably close soon for fear of people and lack of resources. Anyone with a chronic disease is just out of luck as medicine is few and aid cant even be reached to most of these people anymore. It is just so sad.	Sadness	2	3	1	27	25000	6.0	6.0	6.0	6.0	6.0	4.0	2.286	3.571	3.714	307.0	53.0	1.0	train	306.0
		34	4.833333333333333	5.5			"I think that placing blame does little to help in situation like those in the middle east. It seems like everyone is doing their best and those that are at odds keep any positive progress from being made. What are people to do? We hurrah and protract these horrible situations in the middle east and when people are finally forced to pick up and leave we say, ""Sorry, we can't help you."""	Anger/Disgust	1	4	1	29	39000	6.0	6.5	1.0	6.0	5.5	5.0	2.286	3.286	4.143	262.0	25.0	2.0	train	761.0
		305	2.6666666666666665	1.0			I found the number of adolescent deaths in Russia alarming, but not surprising. Young adult suicide rates here in the US have also been increasing since 2004. The fact that the suicides in Russia have been directly linked to social media is very telling. The rise of adolescent suicide here in the US directly parallels the rise of social media.	Neutral	1	6	3	33	64000	6.5	7.0	3.5	4.5	7.0	3.714	1.0	2.429	1.429	183.0	35.0	2.0	train	682.0
		139	2.0	2.0			I just read an article about ranavirus that affects amphibians in the United Kingdom. Apparently, human made garden ponds are contributing to the spread of this virus, but the article seemed wishy washy about how to best deal with the problem. It mentioned that one should not refrain from building garden ponds, but instead refrain from transferring material from said ponds? The whole article kind of missed the mark, I think.	Neutral	1	4	1	29	39000	6.0	6.5	1.0	6.0	5.5	5.0	2.286	3.286	4.143	228.0	25.0	2.0	train	727.0
		397	6.0	6.0			this is so horribloe because anything that effects animals hurts me to the core. They are innocent victims and cant really help themselves in this situation. I think alot needs to be done to make sure the river is restored and blockage is taken away so that this does not happen in the future. These fish cant move debris themsleves and i thin more light needs to shine down on what is happening so maybe a council can come together and monitor or take over and make sure the fish are in a thriving enviroment. I thin if an enviromental emergency is declared and especially in a poor country other countries should step in and lend a helping hand to lesson the suffering to innocent life.	Sadness	2	3	1	27	25000	6.0	6.0	6.0	6.0	6.0	4.0	2.286	3.571	3.714	427.0	53.0	1.0	train	426.0
R_1rfDsNtkx9ueNuH_1	R_1rfDsNtkx9ueNuH	31	4.667	4.25	1.0	1.0	Hey man did you hear about this Palm Oil Company is trying to threaten to take down the worlds third largest Orangutan populations? This is pretty upsetting for me as I am in love with these animals. They are wanting to cut down most of the forest. This place is in Indonesia and this company is also planning on building a drainage canal from the north to the south side of the area for which some work has already reportedly began. I really wished there was a way we can help and protect this land. You would have thought that this would be an important area that needed protected. I mean there are what about any where from 750 to 1750 orangutan..They're classified as endangered now.	sadness	2	2	1	39	74500	3.5	7.0	6.5	7.0	4.5	3.714	3.143	3.714	4.428999999999999					
R_2aOFGSQ3Y7fEc0P_4	R_2aOFGSQ3Y7fEc0P	263	4.5	4.0	1.0	1.0	We are only given one life. I think that everyone wants to live a long and fruitful life. I know that sometimes we all have to do things that we do not want to do. There are certain procedures or policies that we need to follow to be able to maintain a certain life, and lifestyle. I know I don't really enjoy going to the doctor.	neutral	1	6	1	40	125000	6.5	6.0	6.5	7.0	7.0	3.857	1.429	2.4290000000000003	3.143					
R_WoFlOJ6EsGnQNW1_2	R_WoFlOJ6EsGnQNW1	90	4.667	4.875	1.0	1.0	I just read an article Regarding a severe problem in the Chicago area with the fact that their public water supply has high amounts of lead traces. Just what I need, another worldly problem to stress about?!  Article shook me, as the health of not only myself but my children is of the upmost importance to me. I know, I don’t live in the Chicago area, but the article certainly made me think about the water that I drink every day, and my children drink and then just threw foods that I have cooked and prepared. Even my local town has just posted something on the fact that they need $3.2 million to repair the water mains in the one square-mile town as the water pipes are corroded and near health hazard. I Will be researching this locally. I will also be researching for more info on the subject	sadness	2	4	1	34	30000	7.0	6.5	6.5	7.0	7.0	4.857	1.143	3.857	4.571000000000001					
		58	1.1666666666666667	3.875			I find the article comical.  In these places, people are starving to death and the concern of some people is whether zoo animals are getting enough to eat.  The zoo animals should be slaughtered to feed people.  The horses slaughtered to feed to animals should be fed to people.  The animals probably shouldn't be in zoos to begin with, but now that they are they shouldn't come before human needs.  That's idiotic.  Just butcher the zoo animals, feed them to people, and be done with the problem.  That's my opinion.	Neutral	1	6	1	41	28000	2.5	2.0	1.5	2.0	1.0	3.286	4.429	2.714	2.571	37.0	48.0	1.0	train	36.0
R_2QtuGK8mFnoRDra_5	R_2QtuGK8mFnoRDra	409	7.0	1.0	1.0	0.0	So what can we do when genocide occurs in different parts of the world?  Does prayer help? Will war help or hurt more?  When people do not get along, not because of a shortage of food or water, but rather because a belief system is not universal, that is a human tragedy.   Saudi Arabia and Iran are prime examples of animalistic behavior at this point in time.    We here in America pretty much  killed off the American Indians because we wanted the land.  Nothing different is happening in the Middle East.  We always hear that might makes right but that's not truly the case.  Might makes blight and generations suffer till most of it is forgotten.  The moral is too  learn from our mistakes and the bad aspects of what history tries to teach us .	sadness	1	6	1	65	190000	6.5	5.5	4.5	6.0	7.0	4.0	1.714	3.286	3.286					
R_2TZApHajsn2LnN7_2	R_2TZApHajsn2LnN7	87	4.0	3.5	1.0	0.0	I just read this article about the doom of bananas that made me feel like an idiot. I like to think i am smart enough to process this type of article but the words used just had me lost. I wouldn't bother reading it if you still planned on it. It was informative but i felt like i was reading a manual.	sadness	2	5	1	37	46000	6.5	5.5	4.0	6.0	4.5	4.2860000000000005	2.286	3.714	4.0					
R_3slHYierJ4jwMKd_4	R_3slHYierJ4jwMKd	259	4.333	4.625	1.0	1.0	The situation in Yemen with the Saudi-led coalition against the Houthi rebels is one with a lot of controversy, and for good reason. This conflict is rife with airstrikes and drone strikes that drop on civilians and militants alike. Qatar is culpable in the slaughter of citizens, which puts them firmly against the Geneva Conventions. Of course, I do not celebrate the loss of their soldiers' lives, as their families back home are just regular citizens as well in all likelihood.	anger	1	4	1	28	3500	4.0	4.5	1.5	5.5	4.0	4.857	3.143	3.143	4.428999999999999					
		353	3.333333333333333	2.75			I think this is sad, although there aren't many details to know what really happened.  I can't decide whether I think it was worse or better that they died together.  Sort of strange to think what might have happened that cost them both of their lives.  You wonder if one of them caused the death of the other.  That would be pretty awful.  But I guess it doesn't really matter now.  It also seems lonely that the rescue people couldn't even get to their bodies.  Even though they're dead bodies it seems lonely that they'd be there without getting taken back to civilization.	Sadness	1	6	1	41	28000	2.5	2.0	1.5	2.0	1.0	3.286	4.429	2.714	2.571	85.0	48.0	2.0	train	584.0
R_210aQMrmGetROju_2	R_210aQMrmGetROju	86	1.0	1.0	0.0	0.0	It's interesting that so many people would have this reaction to the election. Sure, there's a lot of negative stuff surrounding the election and the president...but a lot of it is rhetoric and media. It doesn't seem as relevant on a local level. I guess it would depend on where you live...maybe I'm too isolated to understand.	neutral	2	6	1	35	60000	5.0	5.5	2.0	4.5	4.5	3.143	3.0	2.286	1.714					
R_WiLHtGk9n1H3i1z_4	R_WiLHtGk9n1H3i1z	272	4.0	4.25	1.0	1.0	It's one thing to kill another person with a motive. But who kills horses and animals?! They are completely innocent creatures. God we have used and abused these animals for centuries. I have no idea what kind of motive this killer has. These horses deserve so much more. It's almost worse than murder in my opinion. I really hope this guy gets caught.	anger	1	4	1	21	45000	5.5	6.5	2.5	6.0	6.0	4.428999999999999	1.857	3.0	4.0					
		23	5.0	4.75			 This story in Caphiridzange is horrific.   The tanker just pulled over to provide fuel to the residents of that region and it completely blew up hurting countless numbers of people.   There were a couple of ideas that were suggested what caused it but nothing was specific.   So many died and so many left injured.   	Neutral/Sadness	2	6	1	62	29000	6.5	2.5	1.0	6.5	2.0	3.571	4.0	2.143	4.429	385.0	8.0	2.0	train	884.0
		39	1.6666666666666667	1.0			so some government people killed a wolf. I feel like most people won't really care about this story too much. im sure this kind of thing happens on a regular basis. I didn't even know there were protected wolves out there. Are they near extinction? Who knows. I know if I was stranded in the wild I wouldn't be upset that a wolf was killed.	Neutral	1	6	1	34	68000	5.5	6.0	5.5	5.0	6.5	3.143	1.714	3.857	2.429	319.0	46.0	1.0	train	318.0
		34	7.0	4.375			This article is about Afghans that are moving back around Afghanistan and really are having a hard time finding anywhere safe and good to live. Some of them have moved to other places but are not able to be successful there and are moving back to Afghanistan even with fighting happening there. I feel so sad for anyone who has to live like this.	Sadness	2	6	1	47	110000	7.0	6.5	4.5	5.5	7.0	5.0	2.143	3.571	5.0	265.0	57.0	1.0	train	264.0
R_PGMi0XWOtOpaa89_1	R_PGMi0XWOtOpaa89	34	5.167000000000001	5.0	1.0	1.0	Having traveled through Afghanistan in the mid-1970s and having had a son deployed in Afghanistan during the US incursion, I can tell you that the country is profoundly backward and disorganized even at the best of times. This influx of refugees will cause chaos on a massive scale. The USA should help. If we are willing to invade and contribute to the destabilization of the country in our own interests, we should also be willing to come in as a magnanimous gesture and help out these poor people in the time of their need.	anger	1	4	1	64	27000	6.5	7.0	4.0	6.5	5.5	4.143	1.714	4.714	4.571000000000001					
R_2B4puxXUMXitzLT_2	R_2B4puxXUMXitzLT	159	3.167	5.375	0.0	1.0	it is about time that for profit education has had the breaks put on them.  provide a substandard education at the students and government's expense in unconsionable.  they should have been shut down years earlier.  there are so many cheaper and better alternatives to obtaining and education.  i don't feel sorry for them	anger	1	7	1	65	79000	6.0	6.0	6.5	5.0	6.5	2.143	1.0	2.571	3.143					
R_2VqoEbnL1j6X9WU_2	R_2VqoEbnL1j6X9WU	100	1.833	2.625	0.0	0.0	This will embolden Trump supporters stance on immigration reform.  I however do not believe just cause you are Muslim or an immigrant you are more prone to committing a terror attack.  Attacks of terror and mass shooting are mostly causes by angry white men. When It's a white man hes a lone wolf and when your from a foreign country its terrorism. I am not making excuses for what happened. Surly its tragic but lets not pool a whole race of people into a negative basket because of one or two bad eggs.	neutral	1	4	1	31	125000	6.5	5.5	5.5	5.5	4.0	3.714	3.429	3.286	3.857					
R_3rGtVh32jHkOn7O_5	R_3rGtVh32jHkOn7O	397	3.167	5.875	0.0	1.0	And in other news ushering in the apocalypse, Paraguay just mismanaged their water resources so poorly that one of their rivers almost completely has dried up, in addition to a drought. I feel like these types of things are going to become extremely common in our near future thanks to our current President's very uninterested feelings about global warming. We will likely never recover since we have long since not done enough to combat it, and millions worldwide are going to suffer and die as stuff like this becomes a seasonal thing.	fear	1	2	1	34	15000	4.0	5.5	1.0	5.0	1.0	3.429	3.143	2.4290000000000003	4.2860000000000005					
		218	1.8333333333333333	3.125			I just read an article about the amount of lead in American water. Apparently. the problem goes beyond the situation in Flint, Michigan. I think that in the coming years the availability of clean water is going to be severely restricted. People are going to be migrating from all over just to get closer to untainted aquifers.	Neutral	1	4	1	29	39000	6.0	6.5	1.0	6.0	5.5	5.0	2.286	3.286	4.143	491.0	25.0	2.0	train	990.0
R_1rftZXLZ8DysqyC_1	R_1rftZXLZ8DysqyC	50	5.332999999999999	1.0	1.0	0.0	Dear C., I just read an article about gun deaths -- specifically when guns are used against children. Small, isolated cases that happened in small towns. As I was reading the background and history of the families, it occurred to me that there's a strong socioeconomic component present, and that the people described weren't what you and I would call middle-class, and definitely not well-educated. It's like we were talking about the other day, I don't think that the dems can possibly win this fight unless they are able to appeal to gun owners. I don't think that this dynamic is going to change -- I mean, when you think about it, guns symbolize power, and in the article I read, what came across is that the people who used them against children (one child against another) need to feel power.	neutral	2	7	1	52	50000	7.0	5.5	2.0	7.0	7.0	4.428999999999999	1.571	3.143	4.857					
		368	3.0	3.625			"I'm so, so tired of rich white boys getting away with doing horrible things just because they're seen as ""respectable,"" and by respectable I mean ""absolute trash to women but men aren't scared so it's fine!"" It's like the Brock Turner rape case (the athlete) all over again. Women get targeted all the time and are scared to do so many things men just don't have to care about."	Anger	2	6	1	25	60000	6.0	5.0	2.0	5.0	6.0	4.143	1.714	3.857	3.429	398.0	13.0	2.0	train	897.0
R_1dp1n3Acz8fdB0F_3	R_1dp1n3Acz8fdB0F	228	5.832999999999999	4.625	1.0	1.0	We’ve been huge supporters of Ashton Kutcher’s campaign against human trafficking so I wanted to let you know of a situation I just became aware of. We usually think of human trafficking involving the kidnapping or sudden disappearance of a person. I just read about two pre-teen girls in Burma who were sent to work to help their family. Everything was legit at first, but as time progressed these poor girls, children really, were denied contact with their parents, tortured, and forced to work for no pay. My heart broke for them and for their parents. What’s even worse, the police ignored the parents’ request for intervention with no success. How agonized the parents must feel that they sent their daughters into this situation.	sadness	2	6	1	66	75000	5.5	4.0	7.0	6.5	5.5	3.571	2.4290000000000003	4.428999999999999	4.571000000000001					
		386	6.5	5.875			PTSD is something I personally know because I have friends with it. It is no joke and really makes people feel vulnerable. The troubles of war are something real dangerous and really make you think twice about enlisting. I think we must do what we can to research this and hope for better outcomes for people.	Hope/Neutral	1	6	2	32	35000	5.5	5.0	2.0	5.5	4.5	3.429	2.857	2.857	2.714	33.0	19.0	2.0	train	532.0
		11	1.3333333333333333	1.25			It's so sad that innocent civilians need to die because of war and fighting. These people did nothing wrong and were just minding their own business before their lives were taken away. It's not fair for the people and it's not fair for the families of the people that were killed as well. They are left without a family member and they have to live with that forever.	Sadness	1	6	1	29	85000	6.75	6.75	6.75	6.75	7.0	4.643	2.0715	4.143	4.643	446.0	17.0	1.0	train	445.0
R_3esJBiP6MpPHx3n_1	R_3esJBiP6MpPHx3n	72	5.667000000000001	2.25	1.0	0.0	Hey! Did you hear about the elephant stuff in Africa? I know you care a lot about the environment so I thought you should see this. There are some countries that are for the poaching of elephants if you can believe it. Some more rural communities say that the animals harm their crops. I've never heard this side of the argument before! I'm not saying I agree with it, but we're over here in America and have a way different perspective on the issues. It's interesting to see how different things are over there.	surprise	2	7	1	29	48000	6.0	4.5	2.5	4.5	3.5	4.143	3.714	4.857	4.857					
R_1o0waJFYMzMZBib_2	R_1o0waJFYMzMZBib	168	2.667	5.5	0.0	1.0	Hey, I know you asked me about what happened to that mother and her baby in New York and here's the full article. It's so sad...that baby could have lived their life to the fullest and now it's cut short. The mother will have to grieve over what happened to...It's so sad that things like this happen.	sadness	2	5	3	24	20000	3.5	6.0	1.0	4.0	2.0	2.4290000000000003	3.0	3.0	3.0					
		39	3.8333333333333335	1.125			I think it's pretty sad that the wolf got killed. I know that they're thinking about reintroducing wolves to a lot of areas because we've killed off so many of them, deer populations are spiking and because of that ticks and lyme disease are on the rise. They're saying it might become an epidemic. Anyway, I guess my point is that some people might say that we don't need to care about wolves because they're harmful or dangerous, but it turns out that we need them. Anyway. It's sad that the wolf died, and kinda crazy that he went out via sniper.	Sadness	2	6	1	25	60000	6.0	5.0	2.0	5.0	6.0	4.143	1.714	3.857	3.429	318.0	13.0	2.0	train	817.0
		57	4.0	4.0			"According to this statement ""But the animals? problems may not be over. ?Our experience rescuing and rehabilitating wild animals that have spent years in captivity?often in appalling and traumatic conditions?has taught us that this can lead to a wide range of physical and psychological problems,? Knight says"" It makes me sad that this situation is not close to being solved and some animals will still suffer."	Neutral	2	6	3	22	100000	5.5	4.5	3.5	6.0	6.0	3.714	2.857	2.571	3.429	98.0	5.0	1.0	train	97.0
		112	5.5	3.0			Dear friend,                                                                                                     I have just read an article about a massive fuel leak in British Colombia. It is threatening all of the wildlife in the area, as well as the water. I am worried about this and hope there is a way to stop it before it gets out of hand.	Fear	1	2	5	29	44000	5.5	6.0	4.5	6.0	5.0	3.714	3.0	3.429	3.429	414.0	7.0	2.0	train	913.0
R_1JL2ePKdivqfBS5_4	R_1JL2ePKdivqfBS5	328	2.333	1.875	0.0	0.0	I just read an article about the presidential campaign trail that focused on how sexist one of the candidates is. It's important that these issues are brought up, especially when it's on a national stage like this. I'm glad to hear people are publicly voicing their concerns and even revealing the troubling incidents they went through involving sexism. I hope after this political race is over, we can all reflect and learn to treat each other better.	neutral	1	5	4	40	70000	5.5	5.5	2.0	6.5	5.5	3.857	1.857	2.714	3.286					
		386	6.833333333333333	2.75			The sights and sounds of war are horrible and I would never blame a person for having PTSD. I'm happy that the one solider although he has PTSD, he is working though it and wants to show people that now all people with PTSD are dangerous and there is away to heal yourself after being in a such bad of a place.	Joy	1	6	3	37	40000	7.0	5.5	1.0	6.5	6.0	4.857	2.0	3.429	5.0	35.0	30.0	1.0	train	34.0
		245	5.5	6.25			Its a good thing the cops are asking for help because I dont feel like anyone else would at this point. The fact that the woman was found wandering in the middle of the night without a coat is scary. It also goes to show that most people do not help others. She was confused and obviously drugged I just hope she gets the help she needs.	Disgust	1	6	2	32	35000	5.5	5.0	2.0	5.5	4.5	3.429	2.857	2.857	2.714	239.0	19.0	1.0	train	238.0
R_2c5BkaXnplhofbP_3	R_2c5BkaXnplhofbP	188	2.333	1.0	0.0	0.0	I wonder if I recognize this guy.  I haven't heard of him up until now.  He was just a little before our time, although I'm sure he had an impact on many of the people we know.  It seems like he influenced many other comedians that I know. I plan on looking up his work to see what is out there of him.	surprise	1	6	1	34	99000	7.0	5.5	4.0	5.5	7.0	4.143	1.0	2.286	2.714					
R_2aOFGSQ3Y7fEc0P_3	R_2aOFGSQ3Y7fEc0P	169	4.5	4.25	1.0	1.0	Whenever you hear about tragedy you can't help but put yourself in their place and worry about how they feel. You wonder about how they react, and how they can believe that a simple accident can hurt someone that they love. I am sure that they will second guess themselves, and wonder how they could let something like that happen.	sadness	1	6	1	40	125000	6.5	6.0	6.5	7.0	7.0	3.857	1.429	2.4290000000000003	3.143					
R_1DDb7pcl8PkL7Rz_4	R_1DDb7pcl8PkL7Rz	321	3.333	5.25	0.0	1.0	Now a days crime rate increased and now no safe for Muslim religion on USA, the american's doing something fishy and wanted. on New York city A Muslim woman’s clothing was set on fire while she walked down New York City’s Fifth Avenue, the police suspected a man who is standing with lighter and who ran away.	neutral	1	7	1	32	70000	1.5	6.5	4.5	1.5	6.5	3.714	2.143	2.4290000000000003	3.429					
		134	1.5	1.125			This was pretty sad.  It is easy to take for granted the fact that we have clean and safe water to drink and bathe with on a daily basis.  These people were struggling and didn't even have that noe basic thing.  I can't imagine living somewhere where I didn't feel like I had clean and safe water.  I don't drink the tap water here but I know I can buy it in a store and drink that safely.  It sounded like these people didn't even have that option and it was totally unfair to them.  	Neutral	2	7	1	38	42000	7.0	3.5	6.5	5.5	6.5	3.429	2.714	2.571	3.857	110.0	24.0	2.0	train	609.0
R_r2BUVTFqmBdanQd_3	R_r2BUVTFqmBdanQd	211	2.167	1.0	0.0	0.0	I personally don't agree with science making these kinds of decisions. Maybe, just maybe, a higher power didn't want these people to reproduce? How do we know that these methods don't permanently change something in the DNA that helps guarantee that a serial killer is born four of five generations down the line. How do we know? There have been no studies. I would guess by this article that since boys that are born using this method also have low sperm counts, that something, or someone, somewhere, is trying to tell them something.	surprise	1	4	1	50	96000	6.0	2.5	1.5	4.0	7.0	1.429	1.143	3.429	1.286					
