message_id	response_id	article_id	empathy	distress	empathy_bin	distress_bin	essay	emotion	gender	education	race	age	income	personality_conscientiousness	personality_openess	personality_extraversion	personality_agreeableness	personality_stability	iri_perspective_taking	iri_personal_distress	iri_fantasy	iri_empathatic_concern	conversation_id	speaker_id	speaker_number	split	essay_id
R_1rftZXLZ8DysqyC_3	R_1rftZXLZ8DysqyC	187	1.0	1.0	0.0	0.0	Gah. The whole Ke$ha mess. Oops, I man Kesha, without the $ sign. I dunno what to think about the eating disorder and whole rehab thing. Her professional life has been such a proverbial sh*tshow, it's really hard to me to believe that this is anything else than attention-seeking. She just seems to have that kind of personality.	sadness	2	7	1	52	50000	7.0	5.5	2.0	7.0	7.0	4.428999999999999	1.571	3.143	4.857					
R_3ElKNT2rbrUZYdR_4	R_3ElKNT2rbrUZYdR	326	2.333	1.375	0.0	0.0	Ya know a lot of people hate the Jews. Yet we both know lots of Jews and I like most of them. To me it doesn't really matter as I never even thought about someone being a Jew until I got older. People are people. Jews are smart. Jews have always been smart at least for generations. Smart people make money and are good at business. Just the way it goes. Jew, Jew Jew, I'm sick of all of the Jew hate. OTOH people have a legitimate concern to fear that Trump being elected will cause problems like WW2 did. After all Jews tend to be Republican and likely donated a ton of money to Trump and they are more powerful today than they ever were. Still whatever, it doesn't affect us.	anger	1	6	1	61	18000	6.5	5.5	5.5	5.5	5.5	3.286	1.571	3.143	3.143					
		148	6.166666666666667	5.75			Wow, I can not believe that this poor elephant has been abused for so many years yet nobody does anything about it. This poor elephant should be taken away from the owner and the owner should be arrested, there is no excuse for this type of behavior, she should be allowed to be free in a elephant sanctuary with other elephants, very sad. 	Sadness	2	6	1	30	55000	6.5	5.5	2.5	5.5	4.5	4.0	3.143	4.0	4.0	332.0	50.0	1.0	train	331.0
R_cCIxe9lO16DgF1f_5	R_cCIxe9lO16DgF1f	385	2.167	2.875	0.0	0.0	People are up in arms over Trump not believing in climate change.  Withdrawing from the Paris treaty supposedly will contribute to global warming, along with doing away with the clean air act Obama passed while in office.  There's so much involved with climate change its hard to tell what is fact.  States are taking measures into their own hands to the extent they can I guess.	neutral	1	7	1	39	76000	7.0	6.5	6.5	6.0	7.0	4.2860000000000005	1.429	4.143	3.0					
R_3m4qsrhUocZSs4L_1	R_3m4qsrhUocZSs4L	41	1.0	1.0	0.0	0.0	This really saddens me that people are so lost now a days. It never solves anything to hurt other people and this just shows a lack of judgement and remorse. It feels as though there had been a disconnect with humanity and we do not have the respect for each other that e once had. I hope that this person can find their way to a better path.	sadness	2	4	3	34	30000	7.0	7.0	7.0	7.0	7.0	5.0	1.286	4.428999999999999	4.571000000000001					
R_72rSTPRBGHQ4NIR_3	R_72rSTPRBGHQ4NIR	212	2.667	2.75	0.0	0.0	I am a little bit on the fences about how to approach immigration and the Mexican border problem. This article talks about different issues President Trump has had his hands in on and how some problems are arising. I think the countries need to stand alone and work on their own issues so they have home build strength. Seems like a lot of compromising is not taking place.	neutral	1	2	1	27	64000	5.0	5.0	3.5	4.0	4.5	3.429	2.571	2.714	3.0					
R_0CE9rf8V9zj643T_3	R_0CE9rf8V9zj643T	244	3.833	4.25	0.0	1.0	There are so many instances of shootings and mass murdering happening around the world today and the example brought up in the article like the Orlando shooting just shows how there is a culture these days where people just don't care anymore. More and more people find it okay to take the lives of innocent people for their own screwed up agenda, whatever that is so that they can show that they have control over the situation. I think a huge problem here is gun laws and there should definitely be some sort of change that occurs.	neutral	2	6	5	24	22000	4.5	5.0	3.5	4.5	2.0	2.714	4.428999999999999	3.286	4.143					
R_3MS8xER2c0yASHT_1	R_3MS8xER2c0yASHT	3	5.332999999999999	3.5	1.0	0.0	It brings me great sorrow to tell you about a horrific incident that left two children without parents after a mechanical failure at an amusement park. It is truly shocking and disturbing that this could have happened. Thee two kids lsot both parents and they watched them drown which is disturbing to think about.	sadness	1	4	2	25	66000	6.0	5.5	5.0	6.0	6.0	3.143	2.4290000000000003	2.571	3.714					
R_3qjkVDIjECLKnKZ_5	R_3qjkVDIjECLKnKZ	368	2.0	6.0	0.0	1.0	this is a very tricky story, Cook a 20-year-old business major with no criminal history, has seemingly been charged, tried, and convicted. there is a lot of evidence coming out to accuse him of sexual harassment and rape but he denies and calls it consensual acts of sex. His lawyer has asked that cook is not crucified on what is being said but by facts.	neutral	1	6	3	30	65000	6.0	6.0	6.0	6.0	6.0	3.714	2.857	3.143	3.714					
R_Q9TGvokg2x7BPsB_4	R_Q9TGvokg2x7BPsB	295	4.0	1.5	1.0	0.0	There has been a lot of fires that are happening in the south.  Many people are being told that they have to wear special masks if they want to go outside because of the smoke from the fires.  People are also investigating to see what really caused the fire many people are suspecting that it's arson that is causing a lot of these fires to happen.  A lot of organizations are asking people to donate water and drinks for the firefighters to quench their thirst while fighting fires.  It truly is a sad thing and hopefully this problem will be resolved sooner than later.	sadness	1	2	3	36	150000	6.5	5.5	4.5	7.0	6.5	4.714	2.0	2.857	4.714					
R_zUqAmBwjEbrwh9v_5	R_zUqAmBwjEbrwh9v	372	4.167	4.25	1.0	1.0	I don't see how things are still happening like this in this point in time. We can not let this continue. It really makes me sad and fell fortunate for what I have. It is insane that people still act like this. Maybe we should send some help over there but it might not be a good idea to get involved and could cause worse problems.	sadness	1	4	1	27	12000	5.0	2.5	4.5	5.5	3.0	3.143	3.429	2.714	2.571					
R_DHy2Rcz9Hym8jgl_1	R_DHy2Rcz9Hym8jgl	16	1.0	1.0	0.0	0.0	These days, women are winning in sports. There has been so many instances of men prevailing in their sport that it is now time that women do the same. Sports have been men's things for so long and I am happy to see that there are women joining the ranks of these top athletes. I am so proud of my species and how we have come so far in equality. I love that there are more even playing grounds now.	joy	2	4	3	34	30000	7.0	7.0	7.0	7.0	7.0	5.0	1.286	4.2860000000000005	4.428999999999999					
		45	3.8333333333333335	2.75			Reading about the violence in Yemen is just emotionally draining. It seems the majority of the casualties are civilians. All of this violence is being spurred on by US backed Saudi violence. I am a firm believer that the US should keep its tendrils out of international conflict. Even when tenuous peace is declared the governments that are installed by US interests are almost destined to fail.	Anger/Disgust	1	4	1	29	39000	6.0	6.5	1.0	6.0	5.5	5.0	2.286	3.286	4.143	114.0	25.0	2.0	train	613.0
R_2aOFGSQ3Y7fEc0P_5	R_2aOFGSQ3Y7fEc0P	374	2.833	2.75	0.0	0.0	I think that this is a kind of funny story. I enjoy hearing about escaped animals from the zoo for some reason. If you think about it the zoo is just one big animal jail. I am sure that I would resent the fact of being locked up if I was a wild animal. Some of these animals have never known the difference.	joy	1	6	1	40	125000	6.5	6.0	6.5	7.0	7.0	3.857	1.429	2.4290000000000003	3.143					
R_2n9TUB8UXeDYQJr_1	R_2n9TUB8UXeDYQJr	14	2.0	2.125	0.0	0.0	I just read an article about cave divers in Florida who died trying to explore the cave system.  It seems like an incredibly dangerous thing to do.  I'm not so sure I see the benefit in doing this kind of activity.  I feel like they people knew the risks and what could happen if things go wrong.  This is not something I'd do myself.	neutral	1	6	1	24	60000	6.5	4.0	6.5	4.0	7.0	3.286	2.857	3.0	2.714					
		49	4.0	4.0			I am writing as regards my thoughts on Polar bears, the poster-child for climate change, are among the animals most affected by the seasonal and year-to-year changes in Arctic sea ice, because they rely on this surface for essential activities such as hunting, traveling and breeding. It is really sad that as a result of climate change the polar bear are now suffering.	Neutral/Sadness	2	6	3	22	100000	5.5	4.5	3.5	6.0	6.0	3.714	2.857	2.571	3.429	54.0	5.0	2.0	train	553.0
		148	5.166666666666667	2.125			Dear friend,                                                                                                     I have just finished reading an article about an african elephant named Nosey. She has been held captive for 30 years. It is a very heartbreaking story and it makes me very sad to see her treated this way.	Sadness	1	2	5	29	44000	5.5	6.0	4.5	6.0	5.0	3.714	3.0	3.429	3.429	331.0	7.0	1.0	train	330.0
R_2xJIlWl26lfyw8n_2	R_2xJIlWl26lfyw8n	92	3.0	7.0	0.0	1.0	Wow! I just read this article about a young boy in China who fell in to a well and was found dead 4 days later. It was SO sad to read this! It stated that boy was helping his dad harvest food when he fell in this well that was only 1 foot wide and that no adults could fit in it to go down and rescue him! Can you even imagine what that father must have been feeling knowing that his little boy fell in this well while helping him and he could not get down there to help him! I just imagine how heartbreaking this whole situation must have been for the family and for the rescuers who spent days trying everything they could to get to him and potentially help him. As a mom, it just makes me sick to think that I could be in a situation like that and do nothing to help one of my babies!	sadness	2	5	1	28	62000	7.0	5.5	5.5	6.5	5.5	4.0	2.714	4.2860000000000005	5.0					
R_Y9xcVEPDGEw28GB_4	R_Y9xcVEPDGEw28GB	335	1.0	1.0	0.0	0.0	A man has took it on himself to kill evasive mice that have doubled in size on an island. The mice feed on birds and when the birds have babies its like a buffet for them to thrive on. I imagine it must be disgusting to have so many mice doing what they please and destroying other animals. It gives me the creeps thinking about it.	disgust	2	4	1	44	26000	4.0	3.0	1.5	5.5	2.0	1.857	4.857	4.714	2.4290000000000003					
		163	5.0	6.25			This girl's life is forever changed.  Pellets destroyed her eyes and her face.   Her mom wraps scarves around her face and eyes to protect her.  :)   I have a great deal of admiration for her as she is speaking the the journalist about what happened.   She wants her government to give her an answer.  She had aspirations of becoming a doctor.   She showed her textbooks to him.   She is in and out of hospitals hoping to retain her eyesight.   	Joy	2	6	1	62	29000	6.5	2.5	1.0	6.5	2.0	3.571	4.0	2.143	4.429	363.0	8.0	2.0	train	862.0
R_1IRRIFlrEvyBc83_1	R_1IRRIFlrEvyBc83	70	4.5	5.0	1.0	1.0	I just read the article on the oil spill.  Even though I do agree with oil digging, when things go wrong, it does have severe consequences.  I feel mostly bad for the birds and sea life, which will obviously be affected.  You would think with all the money these oil companies profit from, they would take more safety precautions, in trying to avoid accidents from happening.  I know the industry creates a lot of jobs and most often, nothing goes wrong.  But when it does, it can be catastrophic for the wildlife in the area and those that live in the area.  Or even those areas that rely on tourism, if people can’t go into the oceans or there is oil spilling onto their beaches.  Not sure what the answer is, or if there even is an answer to it.  It just makes me sad to see those beautiful birds	sadness	2	4	1	59	95000	7.0	6.0	1.0	7.0	4.0	3.714	5.0	4.714	5.0					
		367	6.0	6.0			This is such a disturbing article to read through. You just cant help but feel for the families of the victims so brutually killed. How could this coalition have such a lack of care for human life. The fact that they hit near a humanitarian run hospital is despicable. I am in aw that the us would in any way help when there is faulty information and so much civilian life loss. I feel for all these people that are now injured and have to go hours away for medical help because they had to shut this hospital down.	Disgust/Sadness	2	3	1	27	25000	6.0	6.0	6.0	6.0	6.0	4.0	2.286	3.571	3.714	375.0	53.0	2.0	train	874.0
R_2D8EJ23JFdZWYyR_2	R_2D8EJ23JFdZWYyR	154	5.832999999999999	3.75	1.0	0.0	Nicolas Maduro is the current leader of Venezuela and it has led to major issues and divide in the country. The country is pretty much tyrannical at this point and the government is over-reaching into everyone's lives. Reading about the protests and issues going on makes me feel grateful to be out of that country. I really hope the people can oust him and replace it with a better government.	anger	1	2	1	26	23400	2.0	3.0	1.5	6.5	4.5	4.714	3.429	2.4290000000000003	4.714					
		99	1.0	1.0			Do you ever come across an article that you don't intend to read, but end up reading it anyway? That just happened to me. I have no idea why the personal lives of celebrities are of interest to anyone, let alone on the scale that they are marketed to people. I understand that being able to relate to people of higher status gives the dregs of society some kind of validation, but it just isn't for me.	Neutral	1	4	1	29	39000	6.0	6.5	1.0	6.0	5.5	5.0	2.286	3.286	4.143	136.0	25.0	2.0	train	635.0
R_9FCr4cL8VfeJV6N_4	R_9FCr4cL8VfeJV6N	291	6.332999999999999	5.625	1.0	1.0	You know I have no sympathy for anyone who harms an animal. I'm a huge animal rights advocate and I think those who are cruel to animals deserve very strict punishment. The officer involved should be charged with a crime and fired from their job. I hate it when people hurt defenseless animals and this particular crime did not have to happen! When this happens with children being left in hot cars, there are serious charges leveled and so, there should be the same in this case!	anger	2	5	3	44	38000	7.0	5.5	1.0	5.5	4.0	3.857	3.0	5.0	3.714					
		210	4.833333333333333	5.375			This is such a sad reality we live in now a days. When all you want to do is have fun for one night and forget the stresses in life this happens. In was nice of the band to show up to the memorial that honored all of the victims. It is so sad to think about this happening. Those poor people were just trying to have fun.	Sadness	2	5	1	28	50000	6.0	6.0	5.0	4.5	3.5	5.0	4.143	4.857	5.0	49.0	16.0	2.0	train	548.0
		112	1.0	1.625			After reading the article, i feel so bad for all the wildlife and fishes that are in the body of water that were affected by the spill. We are already harming the earth and it's inhabitants already by polluting the air but this just adds on to it. I really hope we can come to a day where we will be able to help animals instead of harming them.	Sadness	1	6	1	29	85000	6.75	6.75	6.75	6.75	7.0	4.643	2.0715	4.143	4.643	411.0	17.0	2.0	train	910.0
R_ZawuD4lhU731A8p_2	R_ZawuD4lhU731A8p	133	4.5	6.875	1.0	1.0	Maybe they should evaluate him and figure out why he did what he did so that when he gets released, he's not tempted to do it again.  The story really didn't tell why he did it or if he was mentally challenged or anything, it just says that he injured the bird.  The bird is a sad case of what a zoo is.  Those animals should be in the wild, and not cooped up for people to ooh and aah at them in a park	sadness	1	6	1	35	3600	6.5	5.0	1.0	7.0	6.0	4.714	1.429	2.857	4.571000000000001					
R_1IRRIFlrEvyBc83_3	R_1IRRIFlrEvyBc83	192	1.5	1.0	0.0	0.0	These actresses and actors have tons of money.  If they really wanted to do the right thing, they certainly could, for their only son.  They are just selfish people, wanting what they want and unwilling to compromise with each other.  Most actors and actresses are like that.  They are so self-centered.  I can’t stand people like that.  I feel sorry for the poor kid.  Although he will probably grow up to be a self-absorbed, selfish brat, just like his parents.  I swear that I think the less people have, the better off they treat their children and their families.  I have no sympathy for people like these rich snobby people.  They probably have their own jets, tons of money.  Yet, they still can’t compromise.  I wish people like this would get a grip and I wish the media would stop reporting	anger	2	4	1	59	95000	7.0	6.0	1.0	7.0	4.0	3.714	5.0	4.714	5.0					
R_23f3EJw0565sPzq_1	R_23f3EJw0565sPzq	78	5.667000000000001	5.0	1.0	1.0	The article also good.The four key things can do while helping a friend who may have anxiety or hanging out with their friends as much anymore or are always tired and feeling down. Suggest they see a doctor or health professional and/or help them to make  possible, the person's spouse or a mutual friend may be able to give	joy	1	6	1	29	65000	4.0	3.0	3.5	3.5	3.5	3.286	3.857	3.286	3.0					
R_2ckgAvLqxiOMF97_4	R_2ckgAvLqxiOMF97	293	2.667	3.75	0.0	0.0	The article about sleep disorders really hits home, because I know more than one person who would be diagnosed with a sleep disorder. All of these people just happen to be overnight workers, too. The fact that the lack of sleep and quality sleep can lead to a higher risk of stroke is very alarming. So many people need to seek help for sleep disorders, because where the disorder itself may not cause major health issues, it can lead to major health issues.	fear	2	6	1	33	75000	6.5	7.0	3.0	3.5	2.0	3.714	4.428999999999999	4.857	3.714					
R_1dt5fjZkUyYYZa5_3	R_1dt5fjZkUyYYZa5	190	3.167	4.375	0.0	1.0	I can't stand these Jenners and Kardashians. But I have to give them credit for making a living from doing nothing. I guess that is the new American Dream! THey are producing a product that people want to consume. Isn't that sick? The crazy thing is that this family is going to become the normal and accepted family environment.	disgust	2	6	1	42	80000	5.5	6.0	5.5	7.0	3.0	2.571	2.286	3.143	2.714					
R_3npi2r9WK3X6C5j_4	R_3npi2r9WK3X6C5j	318	4.5	4.0	1.0	1.0	Lydia Jones, a spokeswoman for BAFTA Cymru, said Friday that the organization had been told there would be no further details on Mr. Jones’s condition. Primary progressive aphasia is a rare nervous system syndrome that affects a person’s ability to express his or her thoughts and understanding, or to find words, according to the Mayo Clinic. Symptoms begin gradually, often before age 65, and worsen over time. The news of the diagnosis was also reported by the BBC and Britain’sNational Press Association. The announcement of Mr. Jones’s illness dominated Monty Python fan siteson Friday, where it was described as “sad” and “terrible” news. Eric Idle, a co-founder of the ribald, outrageous and internationally acclaimed British troupe, tweeted thanks to fans for their support while noting Mr.	sadness	1	6	3	30	100	4.0	4.0	4.0	4.0	4.0	2.857	3.571	3.714	2.714					
		128	6.0	6.0			I think it is disgusting men in such high power positions use it to just attack women like this. They think they can just get away with it and there actions have no consequences. So many stories like this are popping up and i think we need more education early on about sexual assault and what is okay and not. And more programs for women to feel safe telling on these men so it prevents it from happening again. These poor girls felt so trapped because he was in a position of power and you cant go against that. I think i would be scarred for life if this happened to me. Noone should deal with this alone and it should never be swept under the wrong or at blame of the women.	Anger/Sadness	2	3	1	27	25000	6.0	6.0	6.0	6.0	6.0	4.0	2.286	3.571	3.714	235.0	53.0	2.0	train	734.0
R_2B4puxXUMXitzLT_4	R_2B4puxXUMXitzLT	285	6.0	6.0	1.0	1.0	it is too bad that so many people still deny that polution and man made climate change is destroying our natural world.  it makes me wonder what will be left for my grandchildren to enjoy of our natural world.  in my life i have noticed the degredation of the ourdoors to a fair extent and it is only accelerating.  woe to mankind.	sadness	1	7	1	65	79000	6.0	6.0	6.5	5.0	6.5	2.143	1.0	2.571	3.143					
R_1DYJigUvMXEDqIq_1	R_1DYJigUvMXEDqIq	1	5.5	1.875	1.0	0.0	This was terrible! I'm so glad that those guys got arrested. It's never okay to throw bottles at people, I don't care who you are or what the circumstances are. That poor kid almost died. I mean why? For nothing. Because of a stupid fan rivalry? What do you guys think? Agree or disagree? I can't see how you could take a different stance on it, but just for kicks and giggles. I mean I'm all for sports and stuff but if you get out of control and you hurt someone, that's on you. This is supposed to be fun. These games aren't supposed to be violent, and continued behavior along these lines could damage the reputation of the game, the fans, and the organization. I don't condone it at all and I don't think that you should either. So there you go, that's that. There you go. That's that. There.	disgust	1	6	1	28	65000	6.0	6.5	4.0	6.0	6.0	3.143	3.0	3.429	4.2860000000000005					
		245	6.0	6.0			Articles like this really hit home for me. I think older people should really be protected and watched carefully as this happens alot. Alot suffer from dimentia and have no idea what is going on and can get lost very easily. It makes me think if this was my parent or grandparent I would be heartbroken. She was wondering with no coat probaly cold and very scared. I am very thankful that these officers found her before something bad happened to her. I hope she is able to be reunited with her family quickly and they put safeguards in place so it never happends again. Mayb it is to much for the family now and she requires more assistance like a group home.	Hope	2	3	1	27	25000	6.0	6.0	6.0	6.0	6.0	4.0	2.286	3.571	3.714	240.0	53.0	2.0	train	739.0
R_2UWRxvdzbAww1nz_4	R_2UWRxvdzbAww1nz	331	3.333	4.75	0.0	1.0	The fact that this article shows the global gender gap not being equal until 2196 is particularly disturbing.  And, I wonder why women have dropped out of the workforce globally?  I mean, I did drop out but only after 30 years of employment.  It seems as if, in this day and age, you'd hear that women's participation in the workforce had increased, not decreased.	surprise	2	4	1	50	48000	5.5	5.0	5.0	6.0	5.5	3.857	2.571	3.714	4.143					
		13	6.833333333333333	6.75			In my opinion, this is a mistake that can not happen. Killing civilians at a doctors without boarders camp has no excuse. I agree with doctors without boarders that this is a war crime. I wonder what discipline happened to the sixteen service members. It was wrong to stop the people protesting with the bodies, they have a right to show their anger. 	Neutral	1	6	3	37	40000	7.0	5.5	1.0	6.5	6.0	4.857	2.0	3.429	5.0	433.0	30.0	1.0	train	432.0
R_33etvLZIHitWTq2_5	R_33etvLZIHitWTq2	373	1.0	7.0	0.0	1.0	Heyy! Although this story is sad, I found it definitely alarming and should serve as an example on how this obsession with selfies needs to stop. Apparently, a guy was killed by a python because he was trying to take a good selfie. I think he was one of those people who like to take selfies doing something daring	sadness	1	7	3	30	145000	6.5	5.0	6.5	7.0	7.0	4.571000000000001	2.714	3.857	4.428999999999999					
R_2rB0hjJf3MDIvLy_5	R_2rB0hjJf3MDIvLy	376	1.0	3.0	0.0	0.0	I read an article about the hidden ads in online media and how it may be affecting children. It was about how kids see ads for junk food when they go online. They also spend a lot of time online, especially on YouTube. The videos on there are more influential, since they are real people, and the ads are more convincing. The article made me not want to let the kids watch YouTube or go online, which is really hard to do. I hate that the advertising industry seems to control all of our online media.	anger	2	6	1	39	21600	3.5	3.5	2.0	5.5	3.0	4.428999999999999	3.0	4.428999999999999	4.714					
R_25XQUsv31bkrqNw_5	R_25XQUsv31bkrqNw	337	6.0	6.0	1.0	1.0	I think its sick having these kids working. These kids should be playing and having an education. Why are they doing this? This just shows you how much people care about money. Its disgusting. Human beings are disgusting. I feel so ashamed. God will punish all of these people. We are just being controlled. Someone needs to put this to an end. I really hope these children get the life they deserve. This is why there is a lot of people suffering from depression because of these terrible things going on.	disgust	2	2	2	23	12000	5.0	4.5	3.0	5.0	4.5	4.571000000000001	2.571	4.428999999999999	4.428999999999999					
		53	6.333333333333333	5.125			It is such a shame isn't it that so many people in our country don't understand how important it is to not waste food don't you think? I know that I am also to blame sometimes, and when I throw away food that's been in my fridge I often feel guilty, do you? I really try hard not to waste food though. I wish others felt the same way.	Anger/Disgust	1	6	1	47	105000	6.0	6.5	6.0	4.5	4.0	4.429	1.429	4.571	4.714	476.0	9.0	1.0	train	475.0
